question,answer
How does the program prepare students for working in government agencies?,Language proficiency and cultural knowledge gained from the program can be valuable assets for government jobs requiring Turkish language skills.
Can graduates work in the tourism industry?,"Yes, their language skills and cultural understanding make them suitable candidates for tourism-related jobs focused on Turkish-speaking regions."
"What is the field of study for the South, East and Southeast Asia program?","The program focuses on the countries and cultures of South, East, and Southeast Asia."
Under which professional direction does the program fall?,"The program falls under the professional direction of Sociology, Anthropology, and Cultural Sciences (3.1)."
What is the duration of the program?,The program lasts for 8 semesters (4 years).
What professional qualification do graduates receive?,"Graduates earn the qualification of 'Eastern - South, East and Southeast Asia'."
How do students complete their studies?,The program culminates in the defense of a diploma thesis.
Is the program offered full-time or part-time?,"The description mentions 'Regular' form of education, suggesting a full-time program."
What language is used for the entrance exam?,Bulgarian students take an exam in English or DZI in English (level B2/B1).
What are the program's main objectives?,"The program aims to introduce students to the languages, cultures, economies, and political systems of this growing region. It equips them with knowledge and analytical tools to understand contemporary challenges faced by these societies."
Who is the target audience for this program?,"The program is designed for young people interested in pursuing careers related to South, East, and Southeast Asia."
How does the program approach history within the curriculum?,Historical disciplines are included to provide context and understanding of contemporary processes.
What is the structure of language learning in the program?,"Students choose one main and one additional module, focusing on languages and cultures of specific regions. They gain basic communicative competence in two regionally important languages."
What other subjects are included in the curriculum besides languages?,"The program offers courses on history, economy, culture, society, macro- and microeconomics, political systems, and international relations."
When do students choose their regional specializations?,"Students choose their first regional specialization (China, Japan, or Korea) in the second semester and a second specialization (India, Vietnam, or Indonesia) in the fifth semester."
How are students assigned to modules?,"Students are allocated to modules based on expressed preference and success, following a quota system."
Does the program include any practical experience opportunities?,"An internship in media, government institutions, NGOs, or private companies related to the region is mandatory in the eighth semester."
What skills and knowledge do graduates acquire?,"Graduates gain the ability to navigate socio-political, geopolitical, and economic issues of the region. They understand cultural specifics, historical heritage, and cultural traditions of their chosen areas. They possess basic communication skills and can utilize literature in two regional languages. Additionally, they can analyze documents from international financial institutions and governments."
What career opportunities are available for graduates?,"Graduates can find employment in government or non-governmental departments, journalism, companies working with Asia, or Asian companies seeking investment opportunities in Europe. The program prepares them for the job market through the internship component."
What further education options are available for graduates?,"Graduates can pursue master's programs at the Center for Eastern Languages and Cultures (without a preparatory year) or in fields like international relations, economics, or political science."
What type of degree is offered in Philosophy?,Bachelor's degree
Is the program offered as full-time or part-time (correspondence)?,Correspondence (part-time)
What is the total program duration?,10 semesters
How many total hours of coursework are there?,1455 hours
How are the program's subjects categorized?,"The curriculum is divided into three blocks: Compulsory, Elective, and Optional subjects."
How many compulsory subjects are there?,23 compulsory subjects
What is the total credit value of compulsory subjects?,"The description doesn't explicitly state the credit value of compulsory subjects, but it mentions needing 48 credits per year which likely includes these subjects."
How are compulsory subjects assessed?,Each compulsory subject is assessed by an exam.
How many elective disciplines are offered?,26 elective courses
How many elective courses are required?,Students must choose 4 elective disciplines (60 hours) from the 1st to 8th semesters.
What is the credit value of elective courses?,Each successfully passed elective exam carries 9 credits.
How are elective courses offered?,Specialized elective disciplines are offered at the beginning of each semester with 15 hours of lectures or seminars.
How many elective courses can students choose in total?,Students are required to take at least 5 elective courses throughout the program (315 hours total).
What is the purpose of the optional subjects block?,"The description doesn't elaborate on optional subjects, but it might be related to teaching qualifications."
What is the credit requirement per academic year?,Students need to accumulate 48 credits from compulsory and elective subjects each year.
How does the program culminate?,Students can graduate by passing state exams or defending a diploma thesis by the 9th semester.
When are the state graduation exam sessions held?,First session: June 1-10; Second session: February 1-10.
What is the credit value of state exams or the thesis defense?,Successfully passing the state exam or defending the thesis carries 10 credits.
What professional qualification do graduates receive?,Bachelor of Philosophy
What degree is offered in this program?,Bachelor of Philosophy
What is the primary language of instruction?,English
What is the main objective of the program?,To provide students with a broad foundation in philosophy.
What skills does the program aim to develop?,"Erudition, methodological skills, analytical ability, and critical thinking."
What foundational knowledge do students gain?,Broad and fundamental knowledge in philosophy.
What is the program duration?,4 years (8 semesters)
How is the program structured?,The core consists of 28 mandatory courses and 14 elective courses.
What do mandatory courses cover?,Main systematic subdivisions and historical periods of philosophy.
What do elective courses offer?,In-depth exploration of specific philosophical areas.
Does the program include teacher training courses?,"Yes, some courses are required for obtaining a teaching license in Bulgaria."
What philosophical traditions are emphasized?,"History of philosophy and continental philosophy, with some analytical tradition courses."
What additional modules are available?,1. Teaching license in Philosophy for Secondary Schools (mandatory) and 2. Philosophy with Children practice (elective).
How does the program culminate?,Writing and defending a BA thesis and passing a state teacher's exam (if applicable).
What career opportunities can graduates pursue?,"Specialists and researchers in philosophy, teachers, translators, editors, and various roles in education, research, business, NGOs, and public service."
What are the admission requirements for EU applicants?,"Sofia University entrance exam in English, Bulgarian secondary school matriculation exam in English, and Sofia University Philosophy entrance exam."
What are the admission requirements for non-EU applicants?,Admission based solely on their secondary school degree (no entrance exams required).
Where can I find more information about admissions?,Sofia University's Admission of international students pages: https://www.uni-sofia.bg/index.php/eng/admission/international_students
Is there a program contact person?,"Yes, but the information is not provided in this description."
Does Sofia University have an audio-video archive?,Yes
What type of degree is offered in Psychology?,Bachelor of Psychology
What is the overall purpose of the program?,To introduce students to the fundamentals of scientific psychology and provide a foundation of knowledge and research practice.
What areas of psychology does the program explore?,"Motivation, mental processes, individual differences, personality development, human behavior (normal and pathological), and relationships (family, work, groups)."
What core learning outcome does the program emphasize?,"A deep understanding of mental phenomena, oneself, and others through psychological theories and concepts."
What are the professional goals of the program?,To prepare graduates with basic psychological knowledge who can pursue Master's degrees or work in various public service areas.
What career opportunities can graduates pursue?,"Psychologists in various sectors like education, healthcare, management, government, human resources, the judicial system, NGOs, etc."
"What is the format of the program (e.g., full-time, part-time)?",The description doesn't explicitly mention the format.
What is the program duration?,The description doesn't specify the program duration.
Does the description mention specific courses or curriculum details?,"No, the description focuses on educational and professional goals."
Are there any prerequisites for admission?,The description doesn't mention any admission requirements.
How are students assessed?,The description doesn't elaborate on assessment methods.
Does the program include a thesis or final project?,The description doesn't mention a thesis or final project requirement.
Are there opportunities for internships or practical experience?,The description doesn't mention internship opportunities.
What are the program's strengths or unique features?,The description emphasizes a strong foundation in psychological research and a focus on understanding oneself and others.
How does this program compare to other psychology programs?,There's not enough information to make a specific comparison.
Can graduates practice psychology independently with a Bachelor's degree?,The description suggests graduates may need further education for professional practice.
What are some resources for learning more about the program?,"The description doesn't provide specific resources, but you can likely find more information on the Sofia University website."
Is there a program contact person?,The description doesn't provide contact information.
Does Sofia University have an audio-video archive?,Yes
What does Sociology study?,"Social world, social relations, social change, societal organization, cultural and social contexts, self-identity."
What is the department known for?,Being ranked number one in Bulgaria and offering training that combines theory with quantitative and qualitative research methods.
What are the program's main goals?,"Develop theoretical knowledge, analytical skills, and practical research abilities to understand and address social issues, and contribute to informed public policy development."
How is the program structured?,"Combines compulsory and elective courses, research internships, and an external internship for practical experience."
What career opportunities can graduates pursue with a Sociology degree?,"Sociology, marketing, PR, advertising, academia, schools, media, government, consulting, NGOs, research departments of businesses."
What degree is offered in Sociology?,Bachelor of Sociology
What are the potential additional qualifications?,Bachelor of Sociology and Teacher of Psychology and Philosophical Disciplines in Secondary Schools (requires passing specific teaching courses).
What are the core theoretical and methodological areas covered?,"Main sociological schools and theories, research theory and organization, quantitative and qualitative methods, basic statistics."
What skills are emphasized for graduates?,"Analytical thinking, social problem identification and understanding, research skills, public policy development skills."
What types of internships are required?,At least one research internship and an internship relevant to studies at an outside institution.
What professional competencies do graduates develop?,"Expertise in analyzing current social and political issues, participation in diverse sociological research teams, research needs assessment, public opinion research and analysis, policy development consulting, commercial and political marketing, and advertising strategy development."
What are some potential employers for graduates?,"Sociological, marketing, PR, and advertising agencies; academic institutions; media; government and local authorities; consulting firms; political parties; NGOs; research departments of business organizations, including banks."
Can graduates teach with a Sociology degree?,"Yes, if they complete the additional teaching qualification courses and pass the exams."
What subjects can graduates with a teaching qualification teach?,"Sociology, Philosophy, Logic, Ethics, and Psychology in secondary schools."
"Is there a specific program format (e.g., full-time, part-time)?",The description doesn't mention the format.
What is the program duration?,The description doesn't specify the program duration.
Are there specific courses or curriculum details mentioned?,"No, the description focuses on overall goals, skills, and career paths."
How are students assessed?,The description doesn't elaborate on assessment methods.
Does Sofia University have an audio-video archive?,Yes
What is the overall purpose of the Political Science program?,To develop the ability to critically analyze society and prepare students for careers in managing and shaping it.
What foundational knowledge does the program emphasize?,Broad interdisciplinary knowledge of society.
What is the program's approach to political science?,Openness to new ideas and the latest trends in the field.
What are the professional goals of the program?,To prepare well-rounded graduates with interdisciplinary training for various public service careers.
What career opportunities can graduates pursue?,"Specialists, experts, and teachers in government institutions, NGOs, political parties, unions, international organizations, and media."
What type of degree is offered in Political Science?,"The description doesn't explicitly state the degree, but it likely leads to a Bachelor's degree."
What are the core courses or curriculum details?,The description doesn't mention specific courses.
Is there a focus on a particular political ideology or system?,The description suggests an openness to various perspectives.
What is the overall purpose of the Culturology program?,"To provide students with fundamental knowledge of Bulgarian and global cultural history, introduce core theoretical and methodological concepts, explore current debates in the field, and equip them with practical skills in cultural management."
What foundational knowledge does the program emphasize?,"History of Bulgarian culture, cultural history of Europe and the world."
What theoretical and methodological approaches are covered?,"The description mentions basic theoretical concepts and methods in cultural studies, but doesn't specify details."
What are the professional goals of the program?,To prepare graduates with broad-based interdisciplinary training and adaptability for diverse career paths.
What career opportunities can graduates pursue?,"State cultural institutions, private companies in media, publishing, event planning, advertising, travel, public relations, and NGOs (cultural foundations, research centers, cultural tourism organizations, etc.)."
What type of degree is offered in Culturology?,"The description suggests a Bachelor's degree, but doesn't explicitly state it."
Does the program description mention specific courses?,"No, the description focuses on overall goals, knowledge areas, and career paths."
Are there opportunities for further education after graduation?,"Yes, graduates can pursue Master's and Doctoral programs for further academic development."
Is there a focus on a particular cultural region or period?,"The description emphasizes both Bulgarian and global cultural history, suggesting a broader scope."
Are there any prerequisites for admission?,The description doesn't mention any admission requirements.
How are students assessed?,The description doesn't elaborate on assessment methods.
Does the program include a thesis or final project?,The description doesn't mention a thesis or final project requirement.
Are there opportunities for internships or practical experience?,"The description doesn't mention internship opportunities explicitly, but cultural management skills suggest a potential focus on practical application."
What are some resources for learning more about the program?,"The description doesn't provide specific resources, but you can likely find more information on the Sofia University website."
Is there a program contact person?,The description doesn't provide contact information.
Does Sofia University have an audio-video archive?,Yes
Is the program format full-time or part-time?,The description doesn't mention the format.
What is the program duration?,The description doesn't specify the program duration.
How does this program compare to other culturology programs?,There's not enough information to make a specific comparison.
What skills are particularly emphasized?,The description highlights practical skills in cultural management alongside theoretical knowledge.
What is the degree offered in Library and Information Sciences?,Bachelor of Library and Information Sciences
What is the program duration?,8 semesters (4 academic years)
What are the program formats offered?,Full-time and part-time
What are the admission requirements?,"Successful completion of secondary education and a competitive exam in Bulgarian language and literature, history, and a foreign language."
What are the overall goals of the program?,To equip students with the knowledge and skills to manage information effectively in various settings.
What core areas does the program cover?,"Information processing and analysis, information infrastructure usage, information resource evaluation, information technology (traditional and electronic, local and network), information organization and management, information service models and methods, cultural heritage preservation and access."
What teaching approach is emphasized?,"The program follows modern national and international standards, integrating knowledge and skills development across various information science areas."
Does the program focus on traditional or digital information management?,"The program covers both traditional and digital information technologies, with a focus on practical skills in a networked environment."
What professional competencies do graduates develop?,"Library activity maintenance and development, database and information array evaluation and analysis, information resource organization and management, applying modern technologies in information services, information product planning and creation, collaboration with cultural institutions, and information sector research skills."
What are some potential career paths for graduates?,"Libraries (public, academic, school, special), information centers, documentation services, information service and exchange centers, and information resource dissemination and sales."
Can graduates pursue further education after this program?,"Yes, graduates can continue their studies in a Master's program."
How are students assessed?,The description doesn't elaborate on specific assessment methods.
Does the program include a thesis or final project?,The description doesn't mention a thesis or final project requirement.
Are there internship opportunities?,"The description doesn't explicitly mention internships, but the focus on practical skills suggests potential for hands-on experience."
What are some resources for learning more about the program?,"The description doesn't provide specific resources, but you can likely find more information on the Sofia University website."
Is there a program contact person?,The description doesn't provide contact information.
Does Sofia University have an audio-video archive?,Yes
Does the program emphasize a specific information science theory or approach?,"The description focuses on practical applications but mentions several scientific areas like library science, bibliography, information management, and information communication technologies."
How does this program compare to other Library and Information Sciences programs?,There's not enough information to make a specific comparison.
What is the degree offered in Climate Change and Management?,Bachelor of Science in Climate Change and Management
What is the program duration?,4 years (8 semesters)
What language is the program taught in?,English
What is the overall purpose of the program?,"To prepare graduates with the knowledge and skills to address climate change challenges across environmental, socio-economic, and political aspects."
What core areas does the program cover?,"Environmental sciences, socio-economic sciences, climate change analysis (models, projections), geospatial technologies, climate policy (national and international), climate change impacts, adaptation and mitigation strategies, communication skills."
What are the program's main strengths?,"Interdisciplinary approach, focus on practical skills (data analysis, policy development), and preparing graduates for a high-demand field."
What professional competencies do graduates develop?,"Understanding climate models and projections, using geospatial technologies, applying climate policy, analyzing climate change impacts, promoting environmentally friendly economic transformation, assessing climate risks, developing adaptation and mitigation strategies, and communicating climate issues effectively."
What are some potential career paths for graduates?,"The description doesn't explicitly list careers, but possibilities include climate change research, policy analysis, environmental consulting, sustainability management, and NGOs focused on climate issues."
How are students assessed?,The description doesn't elaborate on specific assessment methods.
Does the program include a thesis or final project?,The description doesn't mention a thesis or final project requirement.
Are there internship opportunities?,"The description doesn't mention internships, but the focus on practical skills suggests potential for real-world application."
What resources can be used to learn more about the program?,"The description doesn't provide specific resources, but you can likely find more information on the Sofia University website."
Is there a program contact person?,The description doesn't provide contact information.
Does Sofia University have an audio-video archive?,Yes
Are there elective courses offered?,"The description mentions elective courses alongside compulsory ones, but doesn't specify details."
Does the program emphasize a specific region or climate change impact?,"The description focuses on general climate change issues and solutions, not a specific region."
How does this program compare to other climate change management programs?,There's not enough information to make a specific comparison.
Are there prerequisites for admission?,The description doesn't mention any admission requirements.
Does the program focus on the science or policy aspects of climate change more?,"The description suggests a balanced approach, covering both scientific understanding and policy development."
What degree is offered in Geospatial Systems and Technologies?,Bachelor of Science (OCS 'Bachelor')
What is the program duration?,4 years (8 semesters)
What is the program format?,Regular (full-time)
What is the overall goal of the program?,"To prepare specialists with theoretical knowledge and practical skills in geospatial data collection, analysis, and application for informed decision-making in various fields."
What core areas does the program cover?,"Earth and social sciences, mathematics, computer science, information systems, regional development, territorial planning, geospatial data analysis, modeling, and visualization."
What professional competencies do graduates develop?,"Collecting, processing, analyzing, and visualizing geospatial data, managing geospatial databases, applying quantitative methods for spatial analysis, building GIS applications, and using geospatial technologies for problem-solving."
What are some potential career paths for graduates?,"Scientific organizations, government agencies, private businesses (IT, consulting), NGOs, environmental protection, resource management, and any field that utilizes geospatial information."
How are students assessed?,The description doesn't elaborate on specific assessment methods.
Does the program include a thesis or final project?,The description doesn't mention a thesis or final project requirement.
Are there internship opportunities?,"The description doesn't mention internships, but the focus on practical skills suggests potential for real-world application."
What resources can be used to learn more about the program?,"The description doesn't provide specific resources, but you can likely find more information on the Sofia University website."
Is there a program contact person?,The description doesn't provide contact information.
Does Sofia University have an audio-video archive?,Yes
