question,answer
How does the program prepare students for careers in translation?,The Master's program in Translation directly equips graduates for this field. The strong foundation in French language likely benefits students interested in pursuing further translation training.
What career paths can graduates of French Philology pursue with a pedagogical qualification?,They can become French language teachers at various educational institutions.
What additional skills might be valuable for graduates interested in working in the field of Francophone civilizations?,"Knowledge of history, politics, and social aspects of French-speaking countries could be beneficial."
How does the program foster critical thinking and analytical skills?,"Courses in literature, linguistics, and potentially other disciplines likely involve analyzing complex texts, interpreting information, and forming sound arguments."
What communication skills are emphasized in the program?,The focus on French language inherently develops strong communication skills in both written and oral forms.
How does the program approach the study of Francophone cultures?,Courses dedicated to Francophone civilizations likely provide students with a comprehensive understanding of the cultures of French-speaking regions beyond France.
What department offers Italian Philology studies?,The Department of Romance Studies.
What degree does the Italian Philology program offer?,Bachelor's degree.
How are students admitted to the Italian Philology program?,Through a competitive exam in Italian.
Where can information about the admission process and exam be found?,The text mentions the 'Directory for Candidate Students of SU 'St. Kliment Ohridski' but doesn't provide a specific link. You might need to check the university website or contact the department.
What are the educational and professional goals of the Italian Philology program?,"The program aims to provide a high-quality university education, train highly qualified specialists in Italian language and literature, and prepare graduates for professional roles as teachers, translators, and Italian language specialists."
What qualification does the program offer?,Graduates receive the qualification of 'Italian language teacher and literature'.
What career paths can graduates of the program pursue?,"Teaching Italian language and literature in schools or language schools, translation (Italian and mixed Bulgarian-Italian companies), state institutions, mass media, etc."
What are the opportunities for further development after obtaining a Bachelor's degree?,Graduates can pursue Master's programs or directly enter the workforce in the mentioned fields.
What are some potential research areas for students in Italian Philology?,"The program likely encourages research in Italian language, literature, history, culture, and potentially specific areas within these subjects."
How does the program prepare students for teaching careers?,"The curriculum likely includes courses in pedagogy, methodology, and practical teaching experience to equip them for effective classroom instruction."
What skills are emphasized in the program to prepare students for translation?,"The program likely focuses on developing strong translation skills in both written and oral communication, alongside in-depth knowledge of the Italian language and potentially translation-specific courses."
What additional qualities might be valuable for graduates interested in working in state institutions or mass media?,"Strong research, writing, and communication skills, alongside cultural awareness and understanding of the relevant fields, could be beneficial."
How does the program foster critical thinking and analytical skills?,"Courses in literature, linguistics, and potentially other disciplines likely involve analyzing complex texts, interpreting information, and forming well-reasoned arguments."
What communication skills are emphasized in the program?,The focus on the Italian language inherently develops strong communication skills in both written and oral forms.
How does the program approach the study of Italian culture?,"Courses on Italian literature, history, and potentially other cultural aspects likely provide students with a comprehensive understanding of Italian society and its cultural heritage."
What are some potential benefits of studying abroad in Italy?,"Immersion in the Italian language and culture can significantly enhance language proficiency, cultural understanding, and overall learning experience."
How can graduates leverage their Italian language skills in the field of translation?,Their strong foundation in Italian and likely further translation training would equip them for translation work between Italian and other languages.
What are some challenges graduates might face when entering the job market?,Competition in specific fields and potentially the need for additional specialized skills depending on the chosen career path.
How can graduates stay updated in their field?,"Continuing professional development through attending conferences, workshops, or pursuing further education can help them stay current with advancements in the field."
What degree does the Romanian Philology program offer?,Bachelor's degree.
What is the form of education for the program?,Regular.
What are the admission requirements?,"A candidate exam in a chosen foreign language (English, French, German, Spanish, Italian, Russian) or Bulgarian language and literature."
What are the educational aims of the Romanian Philology program?,"The program aims to achieve a high level of Romanian language proficiency by the end of the program, alongside providing in-depth knowledge of Romanian history, culture, literature, and linguistics."
What additional understanding does the program offer?,Students gain insights into the place of Romanian language and literature within Balkan studies and Bulgarian-Romanian cultural and literary relations.
What professional goals does the program address?,"It aims to prepare graduates to meet the needs of the region for specialists in Romanian language, literature, and culture."
How do graduates contribute to Romanian-Bulgarian relations?,Their expertise in the language and culture facilitates cooperation between the two countries due to shared historical and cultural features.
What career paths can graduates of the program pursue?,"The program prepares them for careers as teachers, translators, journalists, editors, and researchers in the field of Romanian language and culture."
What are the further development opportunities after obtaining a Bachelor's degree?,Graduates can pursue Master's programs or specializations at Sofia University or other universities in Bulgaria and Romania.
What are some potential research areas for students in Romanian Philology?,"The program likely encourages research in Romanian linguistics, literature, history, culture, and potentially comparative studies with Bulgarian language and literature."
How does the program prepare students for teaching careers?,"The curriculum likely includes courses in pedagogy, methodology, and practical teaching experience to equip them for effective instruction."
What skills are emphasized in the program to prepare students for translation?,"The program likely focuses on developing strong translation skills in both written and oral communication, alongside in-depth knowledge of the Romanian language and potentially translation-specific courses."
What qualities might be beneficial for graduates interested in journalism or editing?,"Strong research, writing, and communication skills, alongside cultural awareness and understanding of current events, could be valuable assets."
How does the program foster critical thinking and analytical skills?,"Courses in literature, linguistics, history, and potentially other disciplines likely involve analyzing complex texts, interpreting information, and forming well-reasoned arguments."
What communication skills are emphasized in the program?,The focus on the Romanian language inherently develops strong communication skills in both written and oral forms.
How does the program approach the study of Romanian culture?,"Courses on Romanian history, literature, and potentially other cultural aspects likely provide students with a comprehensive understanding of Romanian society and its heritage."
What are some potential benefits of studying abroad in Romania?,"Immersion in the Romanian language and culture can significantly enhance language proficiency, cultural understanding, and overall learning experience."
How can graduates leverage their Romanian language skills in the field of research?,"Their strong foundation in Romanian language and potentially further research training would equip them for research projects related to Romanian linguistics, literature, or culture."
What are some challenges graduates might face when entering the job market?,Competition in specific fields and potentially the need for additional specialized skills depending on the chosen career path.
Who is the Head of the Department of German Studies and Scandinavian Studies?,"Maria Endreva, Associate Professor, Ph.D."
What are Maria Endreva's contact details?,"Reception time: Tuesdays 12:00-14:00, room 171, Rectorate. Email: m.endreva@uni-sofia.bg"
When was the Department of German Philology established?,1923.
What was the original name of the department?,Department of German Philology.
When was the Department of Scandinavian Studies established?,1992.
When was the Department of German Philology renamed?,1999.
What are the current specializations offered by the department?,German Philology with an optional module 'Scandinavian Languages' and Scandinavian Studies.
What languages are students trained in?,"The department focuses on German, Swedish, and Norwegian languages. Additionally, the curriculum includes other European Union languages as second foreign languages."
What are some potential career paths for graduates?,"The program prepares graduates for philology careers in German, Swedish, and Norwegian languages, potentially including teaching, translation, and research."
Can graduates find more information about the department online?,The text mentions a website but doesn't provide a specific link. You might need to search for 'Department of German Studies and Scandinavian Studies' on the Sofia University website.
What are some potential research areas for students?,"The program likely encourages research in German, Swedish, Norwegian languages, literature, linguistics, and potentially comparative studies with other European languages."
How does the program prepare students for teaching careers?,"The curriculum likely includes courses in pedagogy, methodology, and practical teaching experience to equip them for effective instruction."
What skills are emphasized for translation purposes?,"The program likely focuses on developing strong translation skills in both written and oral communication, alongside in-depth knowledge of the chosen languages and potentially translation-specific courses."
What additional qualities might be beneficial for graduates interested in research?,"Strong research skills, critical thinking, and analytical abilities are valuable assets for pursuing research opportunities."
How does the program foster critical thinking and analytical skills?,"Courses in linguistics, literature, and potentially other disciplines likely involve analyzing complex texts, interpreting information, and forming well-reasoned arguments."
What communication skills are emphasized?,"The focus on German, Swedish, and Norwegian languages inherently develops strong communication skills in both written and oral forms."
How does the program approach the study of Scandinavian cultures?,Courses dedicated to Swedish and Norwegian cultures likely provide students with a comprehensive understanding of the cultural aspects of these regions.
What are some benefits of studying abroad in Scandinavian countries?,"Immersion in the languages and cultures can significantly enhance language proficiency, cultural understanding, and overall learning experience."
How can graduates leverage their language skills in the field of translation?,"Their strong foundation in German, Swedish, or Norwegian languages, along with further translation training, would equip them for translation work in various sectors."
What department offers English Philology studies?,Department of English and American Studies (EAS).
Who is the Head of the Department?,Prof. Dr. Madeleine Danova.
What are the contact details for the Head of the Department?,"Email: [not provided in text] ; Reception time: Tuesdays 14:00-15:30, room 232, 1st floor."
When was the Department of English and American Studies established?,1928.
How many faculty members work in the department?,"Over 40, including professors with habilitation, doctoral degrees, and doctor of science qualifications."
What degrees does the department offer?,"Bachelor's, Master's, and Doctorate in English Philology."
What is the duration of the Bachelor's program?,4 years (8 semesters).
What specialization do graduates receive in the Bachelor's program?,English language teacher.
When did the department introduce the credit system?,Academic year 2003/2004.
How does the credit system benefit students?,It allows them to choose from a wider range of courses and personalize their studies based on their interests at an earlier stage.
What is the current enrollment in the department's undergraduate program?,Over 400 students.
What Master's programs does the department offer?,"Communication: Language, Literature, Media; Language and Culture; Translation (English and French); Communication: Language, Literature, Media (full-time and part-time); American Studies and Transatlantic Relations (joint program with IF)."
What resources does the department offer to students?,"The English and American Studies Library with a vast collection of books, newspapers, magazines, audio-visual materials, and computer equipment."
Does the department participate in international exchange programs?,"Yes, with established centers of English and American studies abroad."
Does the department accept international students?,"Yes, foreign students can study English Philology at the department."
What factors contribute to the department's reputation?,"Highly qualified faculty, diverse range of programs, extensive library resources, and participation in international exchange programs."
What potential career paths can graduates pursue?,"English language teaching, translation, research, communication-related fields (media, journalism, public relations), etc."
How can graduates stay updated in the field of English language and literature?,"Attending conferences, workshops, pursuing further education, and engaging in professional development opportunities."
What are some potential benefits of studying abroad in English-speaking countries?,"Immersion in the language and culture can significantly enhance proficiency, understanding, and overall learning experience."
How can the department website be accessed?,The text mentions the website: https://eas.uni-sofia.bg/.
What department offers Spanish Philology studies?,Department of Spanish Studies.
Who is the Head of the Department?,Assoc. Dr. Donka Mangacheva.
What are the contact details for the Head of the Department?,"Email: mangacheva@uni-sofia.bg; Office: 125A; Phone: (+359 2) 9308 334; Reception hours: Wednesdays 14:00-16:00, room 125A, Rectorate."
When was the Department of Spanish Philology established?,1961.
What was the original name of the department?,Department of Spanish Philology.
When was the program expanded to include Portuguese Philology?,1992.
What are the faculty qualifications?,The department employs highly qualified teachers from Bulgaria and Spain.
How do the programs compare to those of other universities?,The study programs are similar to those offered by many foreign higher education institutions.
Are the degrees recognized internationally?,"Yes, diplomas of Hispanists are recognized by the Ministry of Education and Culture of the Kingdom of Spain."
Does the department have international collaborations?,"Yes, Sofia University has signed agreements for cooperation and exchange with Spanish and Portuguese universities, as well as Erasmus program agreements with Spanish and French universities."
What degrees does the department offer?,"Bachelor's, Master's, and Doctoral degrees."
Does prior Spanish language proficiency affect admission to the Bachelor's program?,"No, students can apply regardless of their initial Spanish language level."
How does the department address the varying levels of language proficiency?,First-year students are separated into beginner and advanced programs based on their proficiency.
What potential career paths can graduates pursue?,"Spanish and Portuguese language teaching, translation, research, work in Spanish and Portuguese companies, state institutions, and mass media."
How can graduates stay updated in the field?,"Attending conferences, workshops, pursuing further education, and engaging in professional development opportunities."
What are the benefits of studying abroad in Spanish or Portuguese speaking countries?,"Immersion in the language and culture can significantly enhance proficiency, understanding, and overall learning experience."
How does the department website compare to other resources?,The passage doesn't mention a specific website for the department. You might need to search for 'Department of Spanish Studies' on the Sofia University website.
How does the program approach the study of Spanish and Portuguese cultures?,"Courses dedicated to Spanish and Portuguese literature, history, and potentially other cultural aspects likely provide students with a comprehensive understanding of these cultures."
What are some potential research areas for students?,"The program likely encourages research in Spanish and Portuguese languages, literature, linguistics, history, and potentially comparative studies with other Romance languages."
How does the department prepare students for teaching careers?,"The curriculum likely includes courses in pedagogy, methodology, and practical teaching experience to equip them for effective instruction."
What department offers Portuguese Philology studies?,Department of Portuguese and Lusophone Studies.
Who is the Head of the Department?,Prof. Dr. Yana Andreeva.
What are the contact details for the Head of the Department?,Email: y.andreeva@uni-sofia.bg.
When was the program established?,"1992 as a specialty within Sofia University, becoming an independent department in 2021."
What is the department's unique position in Bulgaria?,"It's the only unit offering a full cycle of Portuguese studies and developing Lusophone studies at all degree levels (Bachelor's, Master's, PhD)."
What degrees does the department offer?,Bachelor's and Master's degrees in Portuguese Philology.
What areas does the Bachelor's program focus on?,"Portuguese language as a foreign language, Portuguese, Brazilian, and African Portuguese literature and culture, Portuguese linguistics, and translation."
What is the program's objective?,To equip students with comprehensive knowledge and skills for effective intercultural communication with Portuguese speakers.
What does the Master's program offer?,"Specialized training in Portuguese language, sociocultural aspects, literature, and translation, focusing on contemporary realities in the Lusophone world."
How do graduates qualify professionally?,"They develop expertise in Portuguese language, literature, and culture, translation, understanding Lusophone societies and cultures, and intercultural mediation."
What expertise does the department faculty possess?,"Highly qualified academic staff supplemented by guest lecturers from Portugal, Brazil, and African Lusophone countries, along with industry specialists."
How does the department foster international collaboration?,"Through partnerships with universities in Portugal (Lisbon, Porto, Coimbra, etc.) and Brazil (So Paulo, Fluminense Federal, etc.), enabling student exchange programs."
What research activities does the department engage in?,"The department actively participates in projects, organizes international and national scientific forums, maintains high publication activity, and emphasizes research competitiveness."
What is the 'Jos Saramago' Research Department?,"Established in 2019, it's a collaborative effort between Sofia University and Portugal's Ministry of Foreign Affairs, focusing on research related to the renowned author Jos Saramago."
What are some potential career paths for graduates?,"Portuguese language teaching, translation (from and into Portuguese), work in Lusophone organizations, cultural institutions, media, and various fields requiring expertise in Portuguese language and culture."
How can graduates stay updated in the field?,"Attending conferences, workshops, pursuing further education, engaging in professional development opportunities, and staying connected with the department and its research activities."
What are the benefits of studying abroad in a Lusophone country?,"Immersion in the language and culture significantly enhances proficiency, understanding, and provides a real-world learning experience."
How does the department website compare to other resources?,The passage doesn't mention a specific website for the department. You might need to search for 'Department of Portuguese and Lusophone Studies' on the Sofia University website.
How does the program approach the study of Lusophone cultures?,"Courses likely focus on the culture, history, and social aspects of Portugal and other Portuguese-speaking countries, providing a comprehensive understanding of the Lusophone world."
What is the educational focus of the Bachelor's program in African Studies?,"Broad general preparation in basic linguistics, literature, and cultural disciplines."
What unique aspect does the program offer?,"It's the only program in Bulgaria to provide a full cycle of study in English with French or Portuguese as a second language, while specializing in African Anglophone/Francophone/Lusophone cultures and languages."
What foreign language options does the program offer?,"English (compulsory), French or Portuguese (second language), with Swahili, Malagasy, Afrikaans, Arabic, and Hindi as optional languages."
What is the program structure?,"Eight semesters divided into compulsory, elective, and optional courses. Compulsory courses provide a foundation in philology, while specialized courses offer in-depth knowledge in African studies (linguistics, literature, society, culture, translation)."
What specialization modules are available?,"Anglophone Africa, Francophone Africa, and Lusophone Africa (introduced from the 6th semester onwards)."
What additional language options are available?,"Students can choose to study Swahili, Malagasy, Afrikaans, Arabic, and Hindi as optional subjects."
Does the program offer teacher training qualifications?,"Yes, students can choose an optional pedagogical module to obtain the qualification 'English and French Teacher' or 'English and Portuguese Teacher'."
What professional qualification do graduates receive?,Africanist Philologist or Africanist Philologist. Teacher of English and French/English and Portuguese (if the pedagogical module is chosen).
What language proficiency level do graduates achieve?,B2-C1 level in English and French/Portuguese (according to the European Language Framework).
What additional knowledge do graduates gain?,"In-depth knowledge of African history, economy, politics, and culture."
What are some potential career paths for graduates?,"English and French/English and Portuguese teachers, lecturers, translators, referents for African countries in public institutions and companies, journalists, editors, media experts, etc."
Can graduates teach in the secondary education system?,"Yes, with the optional pedagogical qualification in English and French/English and Portuguese."
Can graduates work as university lecturers?,"Yes, graduates can pursue academic careers in universities."
Can graduates work in translation?,"Yes, graduates can translate between English/French/Portuguese and languages spoken in African countries."
Can graduates work in international organizations?,"Yes, graduates can work as referents for African countries in various public institutions and foreign companies."
How can graduates stay updated in the field?,"Attending conferences, workshops, pursuing further education, engaging in professional development opportunities, and following developments in African studies."
How does the program benefit from its international focus?,"The program equips graduates with the necessary language skills, knowledge, and cultural understanding to work effectively in international settings related to Africa."
What are some potential research areas for graduates in African Studies?,"The program likely encourages research in African languages, literature, history, politics, culture, and social issues."
How does the department website compare to other resources?,The passage doesn't mention a specific departmental website. You might need to search for 'African Studies' at Sofia University.
What degree program does the department offer?,Bachelor's degree in Arabic Studies.
What is the funding type for the program?,"Regular, funded by the state."
Where can one find information about admission requirements?,The directory of Sofia University likely provides details on application and enrollment procedures.
What are the educational aims of the program?,"To provide broad and thorough theoretical and practical training in Arabic linguistics, literature, cultural studies, and social sciences."
