question,answer
What kind of institutions might graduates work in outside of the traditional education system?,"They might work in socio-pedagogical offices, penitentiary institutions, socio-cultural centers, or commissions for anti-social behavior of minors, among others."
What role do graduates play in facilitating qualification and retraining?,"They can work as consultants and specialists in organizing training, qualification, and retraining programs."
What is the purpose of the specialty of special pedagogy?,The purpose is to provide professional training for working with individuals with special educational needs (SEN) and promoting their inclusion in all spheres of life.
What types of disorders do special pedagogues work with?,"They work with auditory, visual, intellectual, neuro-somatic disorders, autism spectrum disorders, multiple disabilities, etc."
What are some tasks performed by special pedagogues?,"They perform diagnostics, corrective and developmental training, collaborate with other professionals, and work with families of individuals with SEN."
What public need does the specialty of special pedagogy address?,It addresses the need for specialists who advocate for inclusion and work towards eliminating discrimination against individuals with disabilities.
What are some requirements for the professional competences of specialists in special pedagogy?,"Requirements include organizing specialized training, teaching general education subjects, preparing and implementing special programs, working in multidisciplinary teams, and documenting the condition of individuals with SEN."
Where can special pedagogues work?,"They can work in special educational institutions, rehabilitation centers, resource centers, centers for special educational support, day care centers, vocational training centers, and more."
What roles can graduates of special pedagogy assume?,"They can work as resource teachers, teachers of children with mental retardation, teachers of hearing-impaired children, auditory-speech rehabilitators, hospital teachers, educators of children with SEN, etc."
What educational degrees are available in special pedagogy?,"Bachelor's degree (eight semesters), Master's degree (one or one and a half years), and Doctorate (three or four years, full-time or part-time)."
What is the typical duration of a Bachelor's degree in special pedagogy?,It typically spans eight semesters (four years) of full-time or part-time study.
What kind of programs do special pedagogues coordinate and implement?,"They coordinate and implement special programs for students with SEN, both in special educational institutions and in integrated and inclusive education settings."
In what environments do special pedagogues work to promote inclusion?,"They work in various environments such as resource centers, centers for personal development, and organizations supporting individuals with SEN, to promote inclusion."
What skills are necessary for special pedagogues to work effectively in multidisciplinary teams?,"Skills such as communication, collaboration, teamwork, and understanding of various disabilities are necessary."
What documentation do special pedagogues prepare?,"They prepare documentation on the condition of individuals with SEN, which may include assessments, progress reports, and individualized education plans."
What are some examples of roles within integrated education settings for graduates of special pedagogy?,"They can work as educators, teachers, rehabilitators, and coordinators in integrated and inclusive education settings."
What are some environments where graduates of special pedagogy might work besides educational institutions?,"They might work in rehabilitation centers, vocational training centers, and day care centers, among others."
What is the role of special pedagogues in supporting children with mental retardation?,"They can work as teachers or educators, providing specialized training and support tailored to the needs of children with mental retardation."
What is the purpose of speech therapy?,"The purpose is to provide professional training for working with individuals of all ages with communication disorders, aiming for their full development, integration, and social realization."
What are some tasks performed by speech therapists?,"They conduct diagnostics, corrective therapy, and prevention of communication disorders, working collaboratively with educators, doctors, psychologists, and rehabilitators."
What areas does speech therapy cover?,"It covers voice and articulation disorders, craniofacial malformations, prosodic disorders, neurological language and speech disorders, dysphagia, communication disorders in mental deviance, intellectual and sensory insufficiency, etc."
What disciplines are included in the academic preparation for speech therapy?,"The academic preparation includes knowledge and skills in psychological-pedagogical, medical-biological, and linguistic areas, along with profiling disciplines related to the speech therapist profession."
What modules are typically covered in each profiling discipline?,"Each profiling discipline usually includes modules on the description of relevant pathology, diagnostic assessment, and basic corrective and therapeutic interventions."
What are some examples of communication disorders addressed in speech therapy?,"Examples include specific language disorders, aphasia, dysarthria, dysphagia, and communication disorders related to mental deviance, intellectual and sensory insufficiency."
How do speech therapists collaborate with other professionals?,"They collaborate with educators, doctors, psychologists, and rehabilitators to provide comprehensive care for individuals with communication disorders."
What age groups do speech therapists work with?,"They work with individuals of all age groups, from children to adults, who experience communication disorders."
What is the goal of conducting diagnostic assessments in speech therapy?,The goal is to identify communication disorders accurately and develop appropriate therapeutic interventions.
How does speech therapy contribute to the integration of individuals with disabilities?,"By addressing communication disorders, speech therapy helps individuals with disabilities integrate into society and realize their full potential."
What is the role of speech therapists in working with families?,"They provide support and guidance to families of individuals with communication disorders, helping them understand and cope with the challenges."
What are some examples of neurological language and speech disorders?,"Examples include acquired and developmental conditions such as aphasia, dysarthria, and specific language disorders."
What skills do speech therapists acquire during their bachelor's degree?,"They acquire practical skills for working with individuals with various communication disorders, along with knowledge of diagnostic procedures and therapeutic interventions."
What role does speech therapy play in the prevention of communication disorders?,"Speech therapy aims to prevent communication disorders through early identification, intervention, and education."
In what settings do speech therapists typically work?,"They work in various settings including hospitals, clinics, schools, rehabilitation centers, and private practices."
What interdisciplinary aspects are involved in speech therapy?,"Speech therapy involves interdisciplinary aspects such as pedagogical, paramedical, and social work, reflecting its diverse application."
What are some responsibilities of a bachelor of speech therapy?,"Responsibilities include organizing and conducting individual and group speech therapy sessions, collaborating with pedagogical specialists in educational institutions, working with medical specialists in clinical settings, participating in social rehabilitation programs, leading speech therapy teams, and maintaining documentation on clients."
What knowledge is required to work with individuals with communication disorders?,"Knowledge of the etiology, symptomatology, diagnosis, and differential diagnosis of communication disorders is essential, along with understanding the means to overcome them."
How does a speech therapist contribute to the education of children with communication disorders?,They work collaboratively with pedagogical specialists to develop individual training programs for integrated children with special educational needs.
What role does a speech therapist play in clinical institutions?,"In clinical settings, they work with medical and paramedical specialists to assess the rehabilitation potential of individuals with language and speech pathology."
How does a speech therapist contribute to social rehabilitation and integration?,They participate in teams of specialists to assess the potential of individuals with disabilities and communication disorders and develop programs for their social rehabilitation and integration.
What documentation does a speech therapist maintain?,"They keep documentation on the entry, current, and exit status of individuals with communication disorders."
What preventive activities does a speech therapist conduct?,They conduct consultations and preventive activities related to the occurrence and overcoming of speech disorders.
How does a speech therapist support the families of individuals with communication disorders?,They guide the integration of families of individuals with communication disorders into speech therapy work.
What skills are necessary for leading speech therapy work?,"Leadership skills, along with expertise in communication disorders and therapeutic techniques, are essential for leading speech therapy sessions effectively."
What is the importance of understanding the etiology of communication disorders?,Understanding the etiology helps in accurately diagnosing and planning appropriate interventions for individuals with communication disorders.
How does a speech therapist adapt therapy sessions based on individual potential?,They tailor therapy sessions to suit the age and individual potential of each person with communication disorders.
What collaborative efforts are necessary for successful speech therapy?,"Collaboration with pedagogical specialists, medical professionals, and social workers is essential for providing comprehensive care to individuals with communication disorders."
What is the goal of maintaining documentation on clients?,The goal is to track the progress of individuals with communication disorders and ensure continuity of care.
How does a speech therapist contribute to the prevention of speech disorders?,They conduct consultations and preventive activities to educate individuals and families on factors contributing to speech disorders and strategies for prevention.
Why is it important for speech therapists to work with families?,"Working with families helps ensure that therapy interventions are supported and reinforced in the home environment, contributing to better outcomes for individuals with communication disorders."
Where can a bachelor of speech therapy work?,"A bachelor of speech therapy can work in special schools and kindergartens, general education schools and kindergartens, hospitals, rehabilitation centers, centers for children with speech disorders, homes for social care, and in independent practice."
What opportunities for further education are available to bachelors in speech therapy?,Bachelors in speech therapy can pursue master's programs to gain additional knowledge and skills in specialized areas of speech therapy or acquire skills in other specialties.
What are the main educational goals of the Bachelor of Physical Education and Sports?,"The main goals include academic general educational psychological-pedagogical preparation, specialized medico-biological training, and specialized sports-methodical training."
What disciplines are covered in the academic general educational psychological-pedagogical preparation of the Bachelor of Physical Education and Sports?,"Disciplines include general and age psychology, theory of education, didactics, and others."
What knowledge does the specialized medico-biological training provide?,It provides knowledge about the human organism and the processes taking place in it.
What skills does the Bachelor of Physical Education and Sports develop?,"They develop skills in positive communication, modern approaches in physical education, regulation of functional load, planning and organizing educational activities, and reporting and analyzing results."
What are the professional competencies of a Bachelor of Physical Education and Sports?,"Competencies include training students in basic and elective sports, planning and organizing physical education and sports activities, positive communication with children and youth, and reporting and analyzing results."
Where can a Bachelor of Physical Education and Sports be professionally realized?,"They can work as physical education and sports teachers, organizers of physical education and sports activities, teachers in children's schools, educators, consultants in mass media, and researchers."
What is the importance of specialized sports-methodical training for the Bachelor of Physical Education and Sports?,"It provides knowledge of sports techniques, tactics, and methodologies for teaching them."
How does a Bachelor of Physical Education and Sports contribute to educational activities?,"They plan, organize, and control physical education and sports activities, ensuring the effective implementation of educational programs."
What is the duration of the Bachelor's program in Fine Art?,"The Bachelor's program in Fine Art lasts for 8 semesters, equivalent to 4 years."
What are the main educational goals of the Bachelor's program in Fine Art?,The main goal is to prepare teachers of fine art for all levels of school education and to form professionals who can effectively participate in the learning process within school education.
What are the major groups of disciplines covered in the training of specialists in Fine Art?,"The training includes special pedagogical, theoretical, general education, and artistic-practical disciplines."
What are some examples of special pedagogical disciplines in the Bachelor's program in Fine Art?,"Special pedagogical disciplines include 'General and age psychology', 'Didactics', 'Theory of education', and 'Methodology of Fine Art'."
What theoretical disciplines are included in the Bachelor's program in Fine Art?,"Theoretical disciplines include 'History of World and Bulgarian Fine Art', 'Theory of the Artistic Image', 'Perspective', and 'Plastic anatomy'."
What are some general education disciplines covered in the Bachelor's program in Fine Art?,"General education disciplines include 'Philosophy of history and culture', 'Aesthetics', and 'Psychology of art'."
What are the artistic-practical disciplines in the Bachelor's program in Fine Art?,"Artistic-practical disciplines include 'Drawing and composition', 'Painting and color science', 'Graphics and Technology', 'Sculpture and artistic constructions', 'Decorative Arts and Combinatorics', 'Conceptual Forms', and 'Graphic Design and Visual Communication'."
Where can graduates of the Bachelor's program in Fine Art be professionally realized?,"Graduates can work as art teachers in all levels of school education, in non-formal education, in museum and gallery institutions, in various cultural and educational organizations, in publishing and advertising businesses, and as freelance artists."
What is the specificity of the training for specialists with the qualification 'Teacher of fine arts'?,"The training includes disciplines specifically tailored to prepare individuals for teaching fine art, covering pedagogical, theoretical, and practical aspects."
What role do artistic-practical disciplines play in the Bachelor's program in Fine Art?,"Artistic-practical disciplines provide hands-on training in various art forms and techniques, essential for the development of practical skills in fine art."
What is the duration of full-time education for the 'Music Media Technologies and Sound Direction' major?,"The full-time education for the 'Music Media Technologies and Sound Direction' major lasts for 8 semesters, equivalent to 4 years."
What is the target orientation of the 'Music Media Technologies and Sound Direction' major?,"The specialty is aimed at individuals with a strong interest in modern digital sound technologies, with the goal of forming highly qualified personnel capable of meeting the challenges in sound design and engineering posed by modern sound technologies."
What professional qualifications do graduates of the 'Music Media Technologies and Sound Direction' major obtain?,"Graduates receive the professional qualification of 'Sound Director, Sound Designer, Media Designer'."
What are some career paths for graduates with a Bachelor's degree in 'Music Media Technologies and Sound Direction'?,"Graduates can work as sound directors in electronic media, specialists in sound processing, sound directors for live events, performing sound recording activities at concerts and performances, music editors, etc."
Who is the Head of the 'Music Media Technologies and Sound Direction' program?,"The Head of the program is chap. Assistant Dr. Hristo Karagyozov, located in Block No. 2, floor 5 - Studio 5, with the email address hkaraguozo@uni-sofia.bg."
Who is the Inspector for the 'Music Media Technologies and Sound Direction' program?,"The Inspector for the program is Valentina Eduard, located in Office 320, with the telephone number 02 9706 237."
What is the role of the Inspector in the 'Music Media Technologies and Sound Direction' program?,The Inspector is responsible for overseeing administrative matters and ensuring compliance within the program.
What types of challenges do sound designers and engineers face in the age of modern sound technologies?,"Sound designers and engineers face challenges related to adapting to rapidly evolving digital sound technologies, ensuring high-quality sound production, and meeting the demands of diverse media platforms."
What skills are emphasized in the 'Music Media Technologies and Sound Direction' program?,"The program emphasizes skills in sound design, sound engineering, media design, and proficiency in modern digital sound technologies."
What facilities are available for students in the 'Music Media Technologies and Sound Direction' program?,Students have access to state-of-the-art sound studios and equipment to gain hands-on experience in sound production and engineering.
What is the duration of regular training for the 'Music' major?,"The regular training for the 'Music' major spans 8 semesters, equivalent to 4 years."
What is the main goal of the curriculum for the 'Music' major?,"The main goal is to prepare music teachers with broad-based training, emphasizing fundamental professional, creative, and practical skills in music pedagogy."
What are some career paths for graduates with a Bachelor's degree in 'Music'?,"Graduates can work as music teachers at all levels of general education schools, including elementary, middle, and upper courses. They can also work as music teachers in classes with advanced music studies, in children's institutions, as leaders of school and extracurricular youth formations, and in administrative positions at educational institutions and municipal/regional commissions on education and culture."
Who is the Head of the 'Music' program?,"The Head of the program is Prof. Dr. Adrian Georgiev, located in Office 219, with the phone number 02 9706 245 and email address aggeorgiev@uni-sofia.bg."
Who is the Inspector for the 'Music' program?,"The Inspector for the program is Vesela Manolova, located in Office 314, with the telephone number 02 9706 244."
What role does the Inspector play in the 'Music' program?,The Inspector is responsible for overseeing administrative matters and ensuring compliance within the program.
What types of skills and training are emphasized in the 'Music' program?,"The program emphasizes fundamental professional, creative, and practical training in music pedagogy, as well as practical skills in music instruction and leadership."
What opportunities are provided for students in the 'Music' program?,"Students have opportunities to acquire practical training, participate in extracurricular youth formations, and gain leadership experience in music-related activities."
What are some optional subjects offered in the 'Music' program?,"Optional subjects may include advanced music theory, music composition, music history, and specialized instrumental or vocal training."
How is the curriculum for the 'Music' program structured?,"The curriculum includes compulsory basic and specialized training, optional subjects, and practical training components, all designed to provide students with comprehensive preparation for a career in music education."
What are the two profiles offered in the Theology major?,The two profiles offered are Teacher of Religion and Religious Specialist.
What is the main goal of the Theology program?,"The main goal is to prepare bachelors of theology with solid theoretical knowledge and practical skills in all major branches of theology, adaptable to professional environments and equipped for independent professional activity and teamwork."
How is admission to the Theology major primarily determined?,Admission is primarily based on grades from the state matriculation exams (DZI) or an oral candidacy exam in Theology for graduates of secondary education before 2008.
What disciplines are included in the course of study for both profiles in the Theology major?,"The course of study includes general disciplines introducing students to main theological directions, liturgical, singing, oratorical, and pedagogical practices."
What is the mandatory ongoing practice for students in the Theology major?,Students conduct ongoing liturgical practice in the Academic Chapel 'St. Kliment Ohridski' of the Faculty of Theology throughout their entire period of study.
What qualifications do graduates of the Theology major acquire?,"Graduates are qualified to organize and lead educational processes in the study of Religion, accurately analyze theoretical trends, communicate effectively with believers and students, perform service for society, and interpret events within an Orthodox church context."
What career opportunities are available to graduates of the Theology major?,"Graduates can work as clergymen, administrators of church departments, employees in social departments, researchers, teachers in theological schools, researchers in church archeology and Christian art, consultants in governmental and non-governmental organizations, and continue their studies at the master's and doctoral levels."
What is the role of graduates with the professional qualification 'Teacher of Religion'?,They can work as teachers in secondary theological schools and secular schools where Religion is taught.
Where can graduates of the Theology major continue their studies?,Graduates can continue their studies in master's and doctoral programs.
Does Sofia University have an audio-video archive?,"Yes, Sofia University does have an audio-video archive."
What is the specialty of the Bachelor program in the Faculty of Mathematics and Informatics called?,The specialty is called 'Data Analysis.'
What level of education does the 'Data Analysis' program offer?,The 'Data Analysis' program offers higher education at the level of OCS 'Bachelor.'
What knowledge and skills do graduates of the 'Data Analysis' program possess?,"Graduates possess knowledge and skills to carry out data collection and analysis activities, make informed decisions, and build models for future actions using mathematical apparatus, statistics, informatics, and modern information technologies."
In what fields can graduates of the 'Data Analysis' program work effectively?,Graduates can work effectively in any field where mathematical apparatus and software tools for data collection and analysis are applied.
What is the duration of full-time study for the 'Data Analysis' program?,The duration of full-time study for the 'Data Analysis' program is 8 semesters.
What is the professional qualification obtained upon completion of the 'Data Analysis' program?,"Upon completion of the program, graduates obtain a Bachelor's Degree in Data Analytics."
What is the major code for the 'Data Analysis' program?,The major code for the 'Data Analysis' program is MID010122.
Where can one find more information about the 'Data Analysis' major?,One can find more information about the 'Data Analysis' major on the regular education section of the Faculty of Mathematics and Informatics' website.
What type of education does the Faculty of Mathematics and Informatics offer for the 'Data Analysis' program?,The Faculty of Mathematics and Informatics offers regular education for the 'Data Analysis' program.
Does Sofia University have an audio-video archive?,"Yes, Sofia University does have an audio-video archive."
What is the main focus of the Bachelor's program in Mathematics?,The main focus of the Bachelor's program in Mathematics is to prepare specialists with fundamental knowledge in various mathematical fields.
What are some of the main mathematical fields covered in the program?,"The program covers algebra, geometry, mathematical analysis, differential equations, complex analysis, probabilities and statistics, operations research, mathematical logic, topology, numerical methods and algorithms, and mechanics."
How flexible is the curriculum of the Mathematics program?,"The curriculum is flexible, with both mandatory and optional subjects offered throughout the entire period of study."
