question,answer
what is the website address of sofia university?,https://www.uni-sofia.bg/eng
when was his holiness the bulgarian patriarch neophyte presented before the lord?,"march 13, 2024"
who received the order of honor of the rector of sofia university?,prof. liu xiumin
what was the reason prof. liu xiumin received the award?,significant contribution to the development of the confucius institute at sofia university
what type of conference was held at sofia university?,open and free geographic information systems (gis) conference
when is the application period for competitive exams for the 2024/2025 academic year (first session)?,"march 5 to april 1, 2024"
"what are the upcoming events at sofia university on march 14, 2024?","workshop of adria arei, public lecture by assoc. dr. sebastian fink, training seminar and lecture by ch. assistant professor dr. svetoslav anachkov, ""patilan people"" after ""patilan kingdom"", ran bosilek"
when is the chess tournament for students and doctoral students?,"march 17, 2024, 10:00"
does sofia university have a library?,yes
does sofia university have a publishing house?,yes
does sofia university have an astronomical observatory?,yes
does sofia university have an alumni club?,yes
does sofia university have an audio-video archive?,yes
what is the website address of sofia university?,https://www.uni-sofia.bg/eng
what is the focus of the finex project?,stimulating and connecting best practices and spaces in the green and digital transition.
what are some of the key organizations involved in the finex project?,"eit digital, eit climate kic, and the cleantech group."
what is the objective of the project investigating the relationship between seismicity and glacier activity in the south shetland islands?,to investigate the connection between earthquake activity and glacier behavior in the region.
when did the project studying the structure of rocks on livingstone island begin?,"january 15, 2024"
what is the purpose of analyzing the structure of sedimentary and igneous rocks on livingstone island?,to understand the deformational history of these rock formations and contribute to deciphering the geodynamic evolution of the south shetland islands.
what time period are the comprehensive stratigraphic and paleoclimatic studies focusing on?,the cretaceous period.
why is studying the fossil record from the cretaceous period important for understanding future climate changes?,"to gain new knowledge about past climate changes and sea levels, which can provide insights into future predictions."
what is the goal of the project researching microflora in the south bay of livingston island?,to comprehensively analyze the microflora and identify potential applications for these organisms in various fields.
what potential applications might the microflora from the south bay hold?,applications in biotechnology and industry.
does sofia university offer resources or information on other research areas besides those mentioned?,"yes, the website mentions other research areas but doesn't provide specific details."
"what is the national portal euraxess, bulgaria?",information not available from the provided snippet.
what is the seventh framework programme 'people' and what activities does it cover?,information not available from the provided snippet.
are there other sections of the sofia university website that provide more details about ongoing research projects?,"likely yes, further exploration of the website is recommended."
does the university website offer information about research opportunities for students and faculty?,"information not available from the provided snippet, further exploration recommended."
what is the official name of the university?,Sofia University St. Kliment Ohridski
what are the main sections of the sofia university website?,"The website includes sections on: The University, Faculties, Admission, Education, Students, Lecturers, News, Electronic Services."
does sofia university offer funding for scientific research projects?,yes
when was the latest competition for scientific research projects announced?,"february 1, 2024 (order no. rd-19-58/01.02.2024)"
what is the deadline for submitting project proposals?,"february 29, 2024, by 11:59 pm"
how are project proposals submitted?,proposals must be submitted electronically through the address: http://eservices.uni-sofia.bg/projects
what types of scientific projects are eligible for funding?,"thematic projects, projects supporting doctoral students, partial funding for scientific forums, support for specialized publications"
how are submitted project proposals evaluated?,proposals are evaluated by the management board of the fni at su based on expert cards specific to each project type.
does the website offer resources for applicants applying for research funding?,"yes, the website provides downloadable documents including regulations, ordinances, handbooks, and forms."
who can be contacted for technical issues with submitting proposals?,kristina ferdinandova or milyana aleksieva
does the website provide information about the university's history?,"yes, the website has a dedicated section on the university's history."
does sofia university have museums and archives?,"yes, the website mentions museums and a university archive."
does the website offer resources for students?,"yes, the website provides a dedicated section for students."
does the website offer resources for faculty?,"yes, the website provides a dedicated section for faculty."
does the website offer an online calendar?,"yes, the website has a section with a calendar."
does the website offer information about study procedures?,"yes, the website has a section with information on study procedures."
does the website offer online payment options?,"yes, the website offers online payment options."
does Sofia University have an audio-video archive?,yes
when is the application period for competitive exams for the 2024/2025 academic year (first session)?,"march 5 to april 1, 2024"
"what type of conference was held at sofia university on march 14, 2024?",open and free geographic information systems (gis) conference
What is the name of Sofia University's digital repository?,DSpace
What type of content can be found in DSpace?,"Research publications, dissertations, faculty work, and other scholarly materials"
Can users create accounts on DSpace?,"Yes, authorized users can edit profiles and receive email updates"
How can users access information about using DSpace?,The website offers a Help section and information about the DSpace software
Does DSpace offer resources specifically for researchers?,"Yes, there is a section titled 'Scientific Research Department'"
What are some of the communities available in DSpace?,"Center for Korean Studies, Department for Language Teaching and International Students, Faculty of Biology, etc."
Does DSpace connect users to external scholarly resources?,"Yes, it provides links to platforms like BioMed Central, SpringerOpen, and DataCite"
Can users find information about open access publishing on DSpace?,"Yes, there is a section on 'Free Use of Works for Educational Purposes and the Role of Creative Commons'"
Does DSpace offer information about copyright and licensing?,"Yes, there is a section on 'License Your Work'"
Can users subscribe to receive updates from DSpace?,"Yes, authorized users can sign up for email updates"
When was the DSpace software developed?,Between 2002 and 2010
Does Sofia University have an audio-video archive?,"While the information provided doesn't explicitly mention an audio-video archive, further exploration of the university website might reveal its existence."
Can users search for publications by author on DSpace?,"Yes, users can enter the author's name in the search bar."
Can users browse collections by subject on DSpace?,"While subject browsing isn't explicitly mentioned, some communities might categorize content by subject."
Does DSpace offer any filtering options for search results?,The information provided doesn't specify any filtering options beyond keyword search.
Can users upload their own research materials to DSpace?,The information provided suggests DSpace is primarily for university-affiliated content. Uploading options might be restricted.
How can users contact the administrators of DSpace at Sofia University?,Contact information for DSpace administrators is not directly available on the provided snippet.
What is the name of the project Sofia University participates in?,Transform4Europe
What are the three main challenges the Transform4Europe alliance aims to address?,"Digital transformation and smart regions, Ecological transformation and sustainability, Societal transformation, community building and inclusion"
How many universities are partners in the Transform4Europe alliance?,Eleven
Can you name some of the partner universities besides Sofia University?,"University of Saarland (Germany), University of Alicante (Spain), University of Silesia in Katowice (Poland), University of Trieste (Italy), etc. (List a few more)"
Is Sofia University involved in creating joint doctoral programs within the alliance?,"Yes, researchers and experts from Sofia University actively participate in this aspect."
Does the project website offer information about individual universities' contributions?,The information provided focuses on the alliance's overall goals. Specific details about each university's role might require further exploration.
Can students from Sofia University participate in exchange programs offered by the alliance?,"Yes, opportunities like the 'Bachelor Courses' and 'Independent Online Spanish Language Course' are mentioned."
What competition is mentioned for students and doctoral students?,A competition for a mixed intensive program called 'BEYOND BORDERS' on the topic of European integration.
How are students informed about opportunities offered by the Transform4Europe alliance?,The website mentions a 'News' section and encourages students to contact the project team.
What skills does the Transform4Europe alliance aim to equip students with?,"Digital, intercultural, and entrepreneurial skills to actively shape Europe's transformations."
Who funds the Transform4Europe alliance?,"The European Union funds the project. However, the views expressed belong solely to the alliance members."
How can someone contact the Transform4Europe project team at Sofia University?,The website provides an email address: transform4europe.su.bg@gmail.com
Does Sofia University have an audio-video archive?,"While the information provided doesn't explicitly mention an audio-video archive, further exploration of the university website might reveal its existence."
What is the website address of Sofia University?,The contact information mentions Sofia University's address but not the website URL.
Does the project website offer information in other languages besides English?,The provided snippet doesn't explicitly mention other languages. The website itself (T4EU site in English) suggests English as the primary language.
Can visitors search the project website for specific information?,A search bar is not readily visible on the provided snippet. Navigating the website structure and exploring the 'About the project' or 'Team' sections might be helpful.
Does the project website offer resources for faculty members?,The information focuses on student opportunities. Specific resources for faculty might require further exploration of the alliance website or Sofia University's website.
How can someone stay updated about the Transform4Europe project's progress?,The website suggests subscribing to the 'News' section and following their social media presence (Facebook is mentioned).
What are some of the future strategies discussed by the Transform4Europe alliance in the European Parliament?,The information snippet doesn't provide details about the specific strategies discussed. Refer to the news section or the alliance website for further updates.
What is the purpose of the Initiative Committee?,To construct a monument to Academician Blagovest Sendov (1932-2020)
Who initiated the idea for the monument?,The academic community of Sofia University and the Bulgarian Academy of Sciences
Who are the co-chairs of the Initiative Committee?,Prof. Anastas Gerdzhikov (Rector of Sofia University) and Prof. Julian Revalski (Chairman of the Bulgarian Academy of Sciences)
Who are some other notable members of the committee?,"The mayor of Sofia, the chairman of the parliamentary committee on education and science, deans and professors from Sofia University and the Bulgarian Academy of Sciences"
Where will the monument be located?,In the park space in front of the Faculty of Mathematics and Informatics at Sofia University
How can people contribute financially to the project?,A donation account in BGN is available at the Bulgarian National Bank. Details like IBAN and account holder are provided.
Where can one learn more about Academician Blagovest Sendov?,The Virtual Museum of Mathematics and Informatics in Bulgaria
What is the date this news article was published?,"November 30, 2022, at 10:17 AM"
Does Sofia University offer resources for students?,"Yes, the website mentions various sections like 'Admission,' 'Student services,' and 'Scholarships.'"
Does Sofia University have an audio-video archive?,"While the information provided doesn't explicitly mention an audio-video archive, the website mentions an 'Audio Video archive' section. Further exploration might reveal its content."
What are some of the academic departments at Sofia University?,The website mentions the Faculty of Mathematics and Informatics. Refer to the 'University' section for a broader list.
Does Sofia University offer scholarships for students?,"Yes, the 'Student services' section mentions scholarships. Refer to that section for details."
How can students access online learning resources?,The website mentions an 'E-learning' section. Explore that section for further information.
Can alumni access online resources from Sofia University?,The information doesn't explicitly mention alumni access. Explore the website's various sections for relevant resources.
What are some of the research centers at Sofia University?,The website mentions the Institute of Mathematics and Informatics. Refer to the 'Science' section for a broader list.
Does Sofia University offer continuing education programs?,"Yes, the 'Education' section mentions 'Continuing education' opportunities."
Can international students apply to Sofia University?,"Yes, the 'Admission' section mentions a dedicated process for 'Admission for foreign students.'"
What are the contact details for Sofia University?,The website mentions the address but not the email address. An email address for the Initiative Committee is provided for the monument project.
Does Sofia University have a social media presence?,The information provided doesn't explicitly mention social media. Explore the website for any links or logos.
What is the purpose of the login page?,It allows registered candidate students to access the university application system.
How can students retrieve a forgotten password?,They can click the 'Forgotten password' button and follow the instructions.
Who is responsible for maintaining the website?,The University Center for Information and Communication Technologies at Sofia University.
Does the library offer resources for students with special educational needs?,"Yes, a section named 'Basic Literature for Readers with Special Educational Needs' is available."
What kind of resources are available in the library's electronic catalogs?,"The information mentions catalogs for books, articles, dissertations, and other scholarly materials."
Does the library provide access to online databases?,"Yes, several databases are listed, including Web of Science, Scopus, and JSTOR."
Can students request materials that are not available in the library?,"Yes, options like interlibrary loan and requesting digitization of specific materials are mentioned."
What are some of the library's services?,"The website mentions services like information literacy training, remote access to resources, and borrowing books."
Does Sofia University have an audio-video archive?,"While the information provided doesn't explicitly mention an audio-video archive, the library website itself focuses on textual resources. Further exploration of the university website might reveal the existence of an audio-video archive."
What is the library's address and contact information?,"The website provides contact details for the Central University Library and the 'Studentski Grad' Library, including addresses, phone numbers, and email addresses."
Does the library offer resources in other languages besides Bulgarian?,The website itself is primarily in Bulgarian. Access to some online databases and collections might offer content in other languages.
Can users search the library website for specific resources?,A search bar is available on the library website.
Does the library offer trial access to online resources?,"Yes, the website mentions current trials for e-book collections from specific publishers."
How can users stay updated about the library's news and announcements?,"The website features a 'News' section and social media links (Facebook, Instagram, YouTube, LinkedIn) are provided."
What are some of the library's special collections?,"The website mentions collections like Bulgarian old printed editions, manuscripts, and foreign rare and valuable editions."
Does the library provide training sessions for students?,"Yes, information literacy training sessions are offered specifically for students."
Can alumni access library resources?,The information doesn't explicitly mention alumni access. Explore the website's sections or contact the library for details.
What is the history of the Sofia University Library?,The website offers a dedicated section with information about the library's history.
How can users donate materials to the library?,The website mentions 'Rules for Donations' but doesn't provide specific contact information. Refer to the 'Contacts' section for library email addresses.
What is the Department of Astronomy known for?,Being the first astronomical observatory in Bulgaria and playing a significant role in the country's scientific development.
When was the Department of Astronomy's Astronomy Circle founded?,"Fall of 1900 by Kiril Popov, the first Bulgarian Doctor of Astronomy."
Does the Department of Astronomy offer any news updates?,"Yes, a 'News' section is mentioned but specific details about the content are not provided."
What is the historical significance of the department?,"It marks the revival of culture, science, and education in Bulgaria after the Liberation."
What is the department's most notable astronomical instrument?,A 6-inch refractor telescope installed in 1897.
How can users contact the Department of Astronomy?,Contact information is not explicitly provided on this webpage. Refer to the Sofia University website for general contact details.
Who can be a member of the Sofia University Alumni Club?,Current students and graduates (alumni) of Sofia University.
What are the goals of the Alumni Club?,"Connecting alumni with the university, facilitating professional experience sharing, mentoring, and internship opportunities."
Does Sofia University have an audio-video archive?,The information provided doesn't explicitly mention an audio-video archive. Further exploration of the university website might reveal its existence.
What is the approximate number of graduates from Sofia University?,The website mentions 'almost a quarter of a million people' since its foundation in 1888.
What are some of the achievements of Sofia University graduates?,"The website mentions contributions in various fields like science, writing, education, and government positions."
Does the Alumni Club offer any career development resources?,The website mentions collaboration with the 'Sector Career Development' at Sofia University. Explore that section for specific resources.
Can alumni access online resources from Sofia University?,The information doesn't explicitly mention alumni access. Specific resources might require university affiliation.
How can alumni stay connected with the university?,Joining the Alumni Club and exploring the Sofia University website for news and events are mentioned as possibilities.
What are some of the university's other departments or faculties?,The website mentions the Faculty of Physics but a broader list might be available on the Sofia University website.
Does the Department of Astronomy offer any public events?,The information doesn't explicitly mention public events. Explore their 'News' section or contact the department for details.
What are some other alumni communities mentioned on the website?,"FEBA, UF, IF, GGF, and FHF Alumni Clubs are mentioned."
Can users search the Alumni Club website for specific information?,A search bar is not readily visible on this webpage. Explore the website navigation menu for relevant sections.
How can users provide feedback to the Alumni Club?,An email address (su_career@uni-sofia.bg) is provided under the 'Quick links' section.
What is the purpose of the eLearn platform?,It provides an online learning environment for Sofia University courses.
Who can access the eLearn platform?,The information suggests it's primarily for enrolled students (indicated by 'My courses' section).
What languages are available on the eLearn platform?,"The provided page shows Bulgarian as the default language with options to switch to English, Russian, Serbian, and others."
How can users contact the eLearn platform administrators?,An email address (elearn@uni-sofia.bg) is provided under the 'Administrators' section.
What is DSpace at Sofia University?,"It's the university's digital repository for research materials like publications, datasets, and theses."
How can users search for specific content in DSpace?,A search bar and browsing options by faculty/department are available.
Does DSpace offer access to open access scholarly journals?,"Yes, links to BioMed Central and SpringerOpen platforms are provided."
Who can be a member of the Sofia University Alumni Club?,Current students and graduates (alumni) of Sofia University.
What are some of the benefits of joining the Alumni Club?,"Networking opportunities, professional experience sharing, mentorship, and internship programs."
Does Sofia University have an audio-video archive?,The information provided doesn't explicitly mention an audio-video archive. Further exploration of the university website might reveal its existence.
What is the approximate number of graduates from Sofia University?,The Alumni Club website mentions 'almost a quarter of a million people' since its foundation in 1888.
What are some of the achievements of Sofia University faculty and alumni?,"The website mentions contributions in various fields like science, writing, education, and government positions."
Can alumni access online learning resources through the eLearn platform?,The information suggests the eLearn platform is primarily for enrolled students. Alumni access might be limited.
How can alumni stay updated about university news and events?,Exploring the Sofia University website and social media channels (mentioned on the Alumni Club webpage) are possible options.
What are some of the Sofia University's faculties?,"The DSpace website provides a list including Faculty of Biology, Faculty of Chemistry and Pharmacy, and others. A more comprehensive list might be available on the main university website."
Does the Alumni Club offer any resources specifically for career development?,The website mentions collaboration with the 'Sector Career Development' at Sofia University. Explore that section for specific resources.
Can users provide feedback to the Alumni Club?,An email address (su_career@uni-sofia.bg) is provided under the 'Quick links' section.
How can users learn more about Sofia University's research activities?,The 'Research at Sofia University' section with a link to DSpace is provided. Explore the university website for further information.
Does the eLearn platform offer mobile app access?,The webpage mentions the availability of a mobile app.
What is the latest news about Sofia University?,"The website mentions the passing of the leader of the Bulgarian Orthodox Church, Patriarch Neophyte, on March 13, 2024."
What recognition did Professor Liu Xiumin receive?,He was awarded the Order of Honor of the Rector for his contributions to the Confucius Institute at Sofia University.
What was the topic of a recent conference held at Sofia University?,"Open and free geographic information systems (GIS), open spatial data, and open methods in distance research."
When is the application period for the first session of Sofia University's competitive exams?,"From March 5 to April 1, 2024."
What are some of the departments or facilities mentioned on the website?,"South Wing, Rectorate Conference Hall, Rectorate Theater Hall, Rectorate University Library, University Publishing House, Astronomical Observatory, and Alumni Club."
What are the instructions for entering project information?,"Projects should be initially entered as proposals, then changed to approved and finally completed."
Does Sofia University have a digital repository?,"Yes, DSpace allows searching for research materials like publications and datasets."
What are some open access scientific journal publishers mentioned on the website?,BioMed Central and SpringerOpen are listed.
Does Sofia University offer any resources related to copyright and open access?,The website mentions 'Free Use of Works for Educational Purposes' and 'Creative Commons' licensing.
